{
  "format": "review-answer-key/1",
  "name": "pf1-t02-vessel",
  "source": "invented",
  "complete_for_flags": true,
  "items": [
    {
      "id": "D1",
      "kind": "defect",
      "standard": "STD-VSL-0102",
      "clause": "4.1",
      "field": "Design pressure",
      "submittal_page": 1,
      "note": "invented: needs at least 8.8 barg, 10 percent above operating"
    },
    {
      "id": "M1",
      "kind": "met",
      "standard": "STD-VSL-0102",
      "clause": "5.2",
      "field": "Corrosion allowance",
      "submittal_page": 1,
      "note": "invented: exactly at the 3 mm minimum"
    },
    {
      "id": "T1",
      "kind": "trap",
      "standard": "STD-VSL-0102",
      "clause": "5.4",
      "field": "Joint efficiency",
      "submittal_page": 1,
      "note": "invented: 85 percent is 0.85, which meets the minimum"
    },
    {
      "id": "M2",
      "kind": "met",
      "standard": "STD-VSL-0102",
      "clause": "6.1",
      "field": "Hydrostatic test pressure",
      "submittal_page": 2,
      "note": "invented: at least 1.3 times 8.5 = 11.05"
    },
    {
      "id": "D2",
      "kind": "defect",
      "standard": "STD-VSL-0102",
      "clause": "8.2",
      "field": "impact test",
      "note": "invented: the sheet does not state it"
    },
    {
      "id": "N1",
      "kind": "not_applicable",
      "standard": "STD-VSL-0102",
      "clause": "9.1"
    }
  ]
}
