{
 "format": "review-answer-key/1",
 "name": "pf1-t01-pump-scanned",
 "source": "invented",
 "complete_for_flags": true,
 "items": [
  {
   "id": "D1",
   "kind": "defect",
   "standard": "STD-PUMP-0101",
   "clause": "4.2",
   "field": "Design pressure",
   "submittal_page": 1,
   "note": "invented: below the 12 barg minimum"
  },
  {
   "id": "M1",
   "kind": "met",
   "standard": "STD-PUMP-0101",
   "clause": "6.3",
   "field": "Rated flow",
   "submittal_page": 1
  },
  {
   "id": "T1",
   "kind": "trap",
   "standard": "STD-PUMP-0101",
   "clause": "7.1",
   "field": "Differential head",
   "submittal_page": 1,
   "note": "invented: 4.5 bar is about 45 m of water"
  },
  {
   "id": "D2",
   "kind": "defect",
   "standard": "STD-PUMP-0101",
   "clause": "5.1",
   "field": "seal plan",
   "note": "invented: the sheet does not state it"
  },
  {
   "id": "N1",
   "kind": "not_applicable",
   "standard": "STD-PUMP-0101",
   "clause": "9.4"
  }
 ]
}
