{
  "format": "review-answer-key/1",
  "name": "pf1-t05-compressor",
  "source": "invented",
  "complete_for_flags": true,
  "items": [
    {
      "id": "D1",
      "kind": "defect",
      "standard": "STD-COMP-0105",
      "clause": "4.3",
      "field": "Discharge temperature",
      "submittal_page": 1,
      "note": "invented: 330 F is about 166 C, above the 150 C limit"
    },
    {
      "id": "T1",
      "kind": "trap",
      "standard": "STD-COMP-0105",
      "clause": "4.4",
      "field": "Inlet pressure",
      "submittal_page": 1,
      "note": "invented: 14.5 psia is 1.0 bar abs, exactly at the minimum"
    },
    {
      "id": "M1",
      "kind": "met",
      "standard": "STD-COMP-0105",
      "clause": "5.2",
      "field": "Seal gas",
      "submittal_page": 1
    },
    {
      "id": "D2",
      "kind": "defect",
      "standard": "STD-COMP-0105",
      "clause": "5.3",
      "field": "Lube oil",
      "submittal_page": 1,
      "note": "invented: not one of the listed oils"
    },
    {
      "id": "D3",
      "kind": "defect",
      "standard": "STD-COMP-0105",
      "clause": "6.1",
      "field": "vibration alarm setpoint",
      "note": "invented: the sheet does not state it"
    },
    {
      "id": "N1",
      "kind": "not_applicable",
      "standard": "STD-COMP-0105",
      "clause": "9.2"
    }
  ]
}
