{
  "format": "review-answer-key/1",
  "name": "pf1-t03-control-valve",
  "source": "invented",
  "complete_for_flags": true,
  "items": [
    {
      "id": "M1",
      "kind": "met",
      "standard": "STD-CV-0103",
      "clause": "5.1",
      "field": "Flow coefficient Cv",
      "submittal_page": 1,
      "note": "invented: offered at least the required Cv"
    },
    {
      "id": "D1",
      "kind": "defect",
      "standard": "STD-CV-0103",
      "clause": "6.2",
      "field": "Seat leakage class",
      "submittal_page": 1,
      "note": "invented: the standard needs Class IV"
    },
    {
      "id": "M2",
      "kind": "met",
      "standard": "STD-CV-0103",
      "clause": "7.1",
      "field": "Maximum noise level",
      "submittal_page": 1,
      "note": "invented: exactly at the 85 dBA limit"
    },
    {
      "id": "T1",
      "kind": "trap",
      "standard": "STD-CV-0103",
      "clause": "7.3",
      "field": "Valve stroke time",
      "submittal_page": 1,
      "note": "invented: 15 s is 0.25 min, which meets the 0.5 min limit"
    },
    {
      "id": "D2",
      "kind": "defect",
      "standard": "STD-CV-0103",
      "clause": "9.3",
      "field": "fire-safe certificate",
      "note": "invented: the sheet does not state it"
    },
    {
      "id": "N1",
      "kind": "not_applicable",
      "standard": "STD-CV-0103",
      "clause": "9.6"
    }
  ]
}
