{
  "format": "review-answer-key/1",
  "name": "pf1-t06-psv",
  "source": "invented",
  "complete_for_flags": true,
  "items": [
    {
      "id": "D1",
      "kind": "defect",
      "standard": "STD-PSV-0106",
      "clause": "4.1",
      "field": "Built-up back pressure",
      "submittal_page": 1,
      "note": "invented: 14 % against the 10 % limit for a conventional valve"
    },
    {
      "id": "M1",
      "kind": "met",
      "standard": "STD-PSV-0106",
      "clause": "4.2",
      "field": "Set pressure",
      "submittal_page": 1
    },
    {
      "id": "T1",
      "kind": "trap",
      "standard": "STD-PSV-0106",
      "clause": "4.3",
      "field": "Relieving capacity",
      "submittal_page": 1,
      "note": "invented: 3700 kg/h is 1.03 kg/s, above the 1.0 kg/s minimum"
    },
    {
      "id": "N2",
      "kind": "not_applicable",
      "standard": "STD-PSV-0106",
      "clause": "4.4",
      "field": "Internal lining",
      "submittal_page": 1,
      "note": "invented: no lining, so the lining thickness clause does not apply"
    },
    {
      "id": "D2",
      "kind": "defect",
      "standard": "STD-PSV-0106",
      "clause": "5.1",
      "field": "orifice designation",
      "note": "invented: the sheet does not state it"
    },
    {
      "id": "N1",
      "kind": "not_applicable",
      "standard": "STD-PSV-0106",
      "clause": "9.1"
    }
  ]
}
