{
  "format": "review-answer-key/1",
  "name": "pf1-t04-exchanger",
  "source": "invented",
  "complete_for_flags": true,
  "items": [
    {
      "id": "M1",
      "kind": "met",
      "standard": "STD-HX-0104",
      "clause": "4.3",
      "field": "Shell side design pressure",
      "submittal_page": 1,
      "note": "invented: above the 12.5 barg minimum"
    },
    {
      "id": "D1",
      "kind": "defect",
      "standard": "STD-HX-0104",
      "clause": "5.4",
      "field": "Tube velocity",
      "submittal_page": 1,
      "note": "invented: above the 3.0 m/s limit"
    },
    {
      "id": "D2",
      "kind": "defect",
      "standard": "STD-HX-0104",
      "clause": "6.1",
      "field": "Fouling resistance",
      "submittal_page": 1,
      "note": "invented: below the 0.0003 m2K/W minimum"
    },
    {
      "id": "M2",
      "kind": "met",
      "standard": "STD-HX-0104",
      "clause": "6.4",
      "field": "Minimum approach temperature",
      "submittal_page": 1,
      "note": "invented: above the 5 K minimum"
    },
    {
      "id": "T1",
      "kind": "trap",
      "standard": "STD-HX-0104",
      "clause": "7.2",
      "field": "Tube wall thickness",
      "submittal_page": 2,
      "note": "invented: 2.0 mm is about 0.079 in, which meets the 0.07 in minimum"
    },
    {
      "id": "N1",
      "kind": "not_applicable",
      "standard": "STD-HX-0104",
      "clause": "9.2"
    }
  ]
}
