{
  "format": "review-answer-key/1",
  "name": "pf1-t07-tank",
  "source": "invented",
  "complete_for_flags": true,
  "items": [
    {
      "id": "D1",
      "kind": "defect",
      "standard": "STD-TANK-0107",
      "clause": "4.1",
      "field": "Shell thickness",
      "submittal_page": 1,
      "note": "invented: 6 mm against the 8 mm minimum"
    },
    {
      "id": "M1",
      "kind": "met",
      "standard": "STD-TANK-0107",
      "clause": "4.2",
      "field": "Design pressure",
      "submittal_page": 1,
      "note": "invented: exactly at the minimum"
    },
    {
      "id": "T1",
      "kind": "trap",
      "standard": "STD-TANK-0107",
      "clause": "4.3",
      "field": "Nominal capacity",
      "submittal_page": 1,
      "note": "invented: 3300 bbl is about 525 m3, above the 500 m3 minimum"
    },
    {
      "id": "D2",
      "kind": "defect",
      "standard": "STD-TANK-0107",
      "clause": "4.5",
      "field": "corrosion allowance",
      "note": "invented: the sheet does not state it"
    },
    {
      "id": "N1",
      "kind": "not_applicable",
      "standard": "STD-TANK-0107",
      "clause": "9.3"
    }
  ]
}
