{
  "format": "review-answer-key/1",
  "name": "pf1-t09-motor",
  "source": "invented",
  "complete_for_flags": true,
  "items": [
    {
      "id": "D1",
      "kind": "defect",
      "standard": "STD-MOT-0109",
      "clause": "4.1",
      "field": "Efficiency class",
      "submittal_page": 1,
      "note": "invented: IE2 is below the required IE3"
    },
    {
      "id": "M1",
      "kind": "met",
      "standard": "STD-MOT-0109",
      "clause": "4.2",
      "field": "Rated voltage",
      "submittal_page": 1
    },
    {
      "id": "T1",
      "kind": "trap",
      "standard": "STD-MOT-0109",
      "clause": "4.3",
      "field": "Rated power",
      "submittal_page": 1,
      "note": "invented: 30 kW is about 40.2 hp, above the 40 hp minimum"
    },
    {
      "id": "D2",
      "kind": "defect",
      "standard": "STD-MOT-0109",
      "clause": "4.7",
      "field": "starting method",
      "note": "invented: the sheet does not state it"
    },
    {
      "id": "N1",
      "kind": "not_applicable",
      "standard": "STD-MOT-0109",
      "clause": "9.6"
    }
  ]
}
