{
  "format": "review-answer-key/1",
  "name": "pf1-t08-transmitter",
  "source": "invented",
  "complete_for_flags": true,
  "items": [
    {
      "id": "D1",
      "kind": "defect",
      "standard": "STD-INST-0108",
      "clause": "4.1",
      "field": "Accuracy",
      "submittal_page": 1,
      "note": "invented: 0.25 % is worse than the required 0.1 % or better"
    },
    {
      "id": "M1",
      "kind": "met",
      "standard": "STD-INST-0108",
      "clause": "4.2",
      "field": "Output signal",
      "submittal_page": 1
    },
    {
      "id": "T1",
      "kind": "trap",
      "standard": "STD-INST-0108",
      "clause": "4.3",
      "field": "Ambient temperature limit",
      "submittal_page": 1,
      "note": "invented: 85 C upper limit is above the 70 C required"
    },
    {
      "id": "D2",
      "kind": "defect",
      "standard": "STD-INST-0108",
      "clause": "4.6",
      "field": "ingress protection",
      "note": "invented: the sheet does not state it"
    },
    {
      "id": "N1",
      "kind": "not_applicable",
      "standard": "STD-INST-0108",
      "clause": "9.5"
    }
  ]
}
